{
  "schemaVersion": 1,
  "version": "piagent-webui-workspace-paths-v1",
  "generatedAt": "2026-10-22T00:00:00.000Z",
  "identity": {
    "projectRef": "project_01",
    "runtimeInstanceId": "runtime_01",
    "sessionRef": "session_01",
    "taskId": null,
    "taskRunId": null,
    "agentOperationId": null,
    "toolCallId": null
  },
  "query": "hello",
  "truncated": false,
  "suggestions": [
    {
      "value": "hello.ts",
      "label": "hello.ts",
      "detail": "hello.ts",
      "kind": "file"
    }
  ]
}
